<?xml version="1.0" encoding="utf-8" ?>
<SMVConfig
  xmlns:xsi="http://www.w3.org/2001/XMLSchema-instance"
  xsi:noNamespaceSchemaLocation="Config.xsd"
>
  <!-- Please don't add any comments with double hyphens in them.                                                                              -->
  <!-- XML does not support a double hyphen within a comment, since it is a delimiter.                                                         -->
  <!-- Available variables which can be used inside actions :                                                                                  -->
  <!-- $assemblyDir         : Directory where SMV binaries are located            [Available in all actions]                                   -->
  <!-- $workingDir          : Directory where SMV is run                          [Available in all actions]                                   -->
  <!-- $actionName          : Name of the current action                          [Available in all actions]                                   -->
  <!-- $actionPath          : Path where the current action is run                [Available in all actions]                                   -->
  <!-- $configFilePath      : Path of the config file provided to SMV             [Available in all actions]                                   -->
  <!-- $logFilePath         : Path to the log file                                [Available in all actions, if SMV is run with /log:<path>]   -->
  <!-- $outputDir           : Directory where the build files are generated       [Available in all actions following InterceptedBuild]        -->
  <!-- Run the normal build, intercepted build and the scan step -->

  <Variables>
    <SetVar key="projectFile" value="ms\ntdll.mak" />
  </Variables>
  
  <Build>

    <!-- Do a normal build first to ensure everything builds correctly. -->
    <Action name="NormalBuild" nextAction="Clean" breakOnError="true">
      <Command value="&quot;c:\program files (x86)\microsoft visual studio 12.0\vc\vcvarsall.bat&quot;" arguments="x86" />
      <Command value="nmake" arguments="-f [$projectFile] > smvbuild.log"/>
    </Action>

    <Action name="Clean" nextAction="InterceptedBuild" breakOnError="true">
      <Command value="&quot;c:\program files (x86)\microsoft visual studio 12.0\vc\vcvarsall.bat&quot;" arguments="x86" />
      <Command value="nmake" arguments="-f [$projectFile] clean"/>
    </Action>

    <Action name="InterceptedBuild">
      <Command value="&quot;c:\program files (x86)\microsoft visual studio 12.0\vc\vcvarsall.bat&quot;" arguments="x86" />
      <Command value="SET" arguments="SMV_OUTPUT_DIR=[$outputDir]" />
      <Command value="SET" arguments="path=%smv%\bin;%path%" />
      <Command value="nmake" arguments="-f [$projectFile] > smvbuild.log"/>
    </Action>

  </Build>
</SMVConfig>
  
